id,name,flower_lang,info,type,native,flower
29371,수국,"냉정, 무정, 거만 ","수국은 토양 산도에 따라 꽃색이 달라져 어린이들 교육용으로도 종종 쓰인다. 하지만 꽃병 용액의 pH를 달리하여 실험한 결과, 큰 차이가 없어 종이나 품종에 따라 차이가 있는 것 같다. ","수국류는 낙엽성 관목류가 대부분으로 세계적으로 약 80 종 이상이 분포하고 있는데, 원산지는 주로 아시아 동부(우리나라 포함), 미국 북부와 남부지역의 숲 속이다. 우리나라에서는 원종들도 부분적으로 이용되고 있으나, 서양에서는 대부분 개량된 품종들이 정원용으로 많이 이용되고 있다. 우리나라에 귀화되었거나 자생종으로 1957년도에 미국에서 들어 왔다는 '미국수국', 흔히 재배되는 꽃이 공처럼 생긴 '수국', 경기 강원지역에서 자생하는 '산수국', 산수국에서 유래된 '탐라산수국', '꽃산수국', '떡잎산수국' 울릉도에서 나는 '등수국', 일본에서 들어 왔다는 '나무수국', 울릉도나 남부 섬에서 나는 '바위수국' 등이 있다.",일본; 전국에 식재.,"꽃은 무성꽃이며 6 ~ 7월에 개화하고,  편평꽃차례는 크고 둥글며 지름 10 ~ 15cm로, 꽃받침조각은 4 ~ 5개이고 꽃잎모양이며 하늘색 또는 연한 붉은색으로 변한다.  암술은 퇴화되어 결실은 하지 못한다."
27155,딸기,"질투, 시기",예전 도시근교의 딸기밭에 입장료를 내고 들어가면 자기가 먹고 싶은 데로 얼마든지 따먹던 시절이 떠오른다. 노지딸기는 요즘 한창 나오는데 지금은 거의 연중 어느 때나 먹을 수 있도록 재배작형이 세분화되어 있다.,"장미과에 속하는 식물이다. 세계적으로 약 12종이 아시아, 북미 및 칠레지방에 온대지역의 볕이 잘드는 초원에서 자생하고 있다. 우리나라에는 식용인 딸기와 꽃이 희고 고산지대의 숲 근처에서 자라는 흰땃딸기, 이와 비슷하지만 소화경이나 뿌리가 내리는 위치가 다른 땃딸기 등 3종이 분포한다.",전국 각지에서 재배한다.,꽃은 5-6월에 피며 지름 3cm로서 백색이고 꽃대 끝의 취산꽃차례에 5~15송이가 달린다. 꽃받침조각은 5-6개로서 피침형이며 끝이 뾰족하고 녹색이며 부악편은 끝이 뾰족하고 피침형이며 겉에 털이 있고 꽃받침보다 다소 짧다. 꽃잎은 5-6개로서 꽃받침보다 훨씬 길며 수술은 많다.
36151,엉겅퀴,건드리지 마세요,"자신이 건드림 당하는 걸 싫어서가 아니라, 자신을 만지는 사람에게 상처줄까 두려워 붙여진 꽃말 같다. 누군지 꽃말을 참 잘 붙였다. 실제 엉컹퀴는 온 몸에 억센 털들이 많이 나 있어 너무 꽉 쥐면 손바닥에 가시가 박힌다. ","엉겅퀴류도 대가족이다. 지구상에 약 200종이나 사는데, 이년생인 것과 영년생인 것이 있다. 우리나라에도 꽤 많은 종들이 자생하고 있는데, 엉겅퀴와 같은 학렬에 속하는 큰엉겅퀴(덩치가 큰), 도깨비엉겅퀴(원줄기에 홈 파진 줄이 있는), 동래엉겅퀴(동래에 나는), 바늘엉겅퀴(키가 작고 잎끝이 뾰족), 버들잎엉겅퀴(잎의 버드나무 잎 닮은), 흰잎엉겅퀴(잎 뒷면이 흰), 고려엉겅퀴(잎에 큰 결각이 없는), 정영엉겅퀴(지리산 정령치에 나는), 물엉겅퀴(울릉도에 나는)가 있고, 자식뻘로는 좁은잎엉겅퀴, 가시엉겅퀴, 흰가시엉겅퀴 등이 있다. ","우리 나라 전국에 분포하여, 만주, 중국, 우수리에도 분포한다.","꽃은 6-8월에 피며 지름 3-5cm로서 가지 끝과 원줄기 끝에 1개씩 달리고 총포는 둥글며 길이 18-20mm, 지름 25-35mm이고 포편은 7-8줄로 배열되며 겉에서 안으로 약간씩 길어지고 끝이 뾰족한 선형이다. 꽃은 전부 관상화이고 꽃부리는 자주색 또는 적색이며 길이 19-24mm이다."
30985,채송화,가련함,채송화는 어렸을 때 앞마당이나 동네 공터에서 흔히 볼 수 있었던 식물이었지만 지금은 시골에서도 찾아보기 힘들다. 대신 주택 정원의 화단용으로 많이 심기고 있고 아파트 베란다에서 분화용으로 기르고 있다.,"채송화도 종류가 다양하다. 지구상에 약 100여 종이 온대나 열대지방의 모래땅 또는 건조한 곳에서 자생하고 있으며, 우리나라에는 자생하지 않는다.",전국에 분포한다.,"7-10월에 붉은색, 흰색, 노란색 또는 자주색의 꽃이 피며 가지 끝에 한개 때로는 두개 이상씩 달린다. 꽃의 지름은 3cm정도로서 화경이 없으며 밤에는 오므라든다. 꽃받침조각은 두 개로서 넓은 달걀모양이고 막질이며 꽃잎은 다섯개로서 거꿀달걀모양이고 끝은 약간 패어져 있다. 수술은 많고 암술대에는 다섯 내지 아홉 개의 암술머리가 있다."
39664,초롱꽃,"인도, 침묵",초롱꽃은 꽃 모양이 초롱을 닮아 예로부터 친근감이 있는 가장 한국적인 식물 중의 하나이다. 초롱꽃은 꽃이 화려하진 않지만 자생화 중에서 유난히 꽃이 크고 시원한 느낌을 주는 꽃이다.,"우리나라에는 '초롱꽃', 꽃에 붉은 기가 도는 '섬초롱꽃', 마치 하나의 꽃방망이처럼 생긴 '자주꽃방망이' 등 총 7종이 분포하는데, 세계적으로는 약 300여종 이상이 자생한다. 현재 국내 연구기관이나 개인 육종가들이 절화용이나, 분화용 및 화단용으로 새로운 품종을 개발하고 있다. 초롱꽃류는 꽃이 크고 모양이 좋아 우리가 적극 개발해야 할 자생식물 중의 하나로 농촌진흥청에서 육성한 섬초롱꽃으로 '성인봉'과 '금산'이라는 품종이 있다. ","한국, 일본, 동부시베리아에 분포한다.
남부와 중부, 중부지역의 산의 낮은 곳에 자생한다.","꽃은 6-8월에 피고 백색 또는 연한 홍자색 바탕에 짙은 반점이 있으며 긴 화경 끝에 종같은 꽃이 달려 밑으로 처진다. 꽃의 길이는 4~8cm이며, 꽃통은 3.5cm로 아래를 향하여 핀다. 꽃받침은 5개로 좁게 갈라지며 녹색이고 털이 있으며 열편 사이에 뒤로 젖혀지는 부속체가 있으며 수술은 5개, 암술 1개, 씨방은 하위이다."
27110,토마토,완성된 아름다움,토마토는 우리가 탐하는 것이 꽃이 아니라 완성된 열매인데다 이 과실들이 잘 익으면 빨갛게 물들어 보기에도 아름답기 때문에 붙여진 꽃말이 아닌가 싶다. 오늘의 꽃은 주제가 관상을 목적으로 하는 꽃 이야기라 관상측면에서 이야기한다.,토마토는 가지과 식물로 남미 서부 고원지대가 원산지이다. 고향에서는 여러해살이풀로 자라지만 온대지역에서는 개량되어 1년생으로 재배된다. 우리나라에는 1614년대에 도입된 것으로 추정되고 있다.,재배한다.,마디사이의 중앙에서 화경이 나와 황색 꽃이 달리고 꽃자루의 기부에 관절이 있어 그속에서 꽃이 떨어진다. 꽃받침은 여러 개로 갈라지며 열편은 선상 피침형이고 꽃부리는 얕은 접시 모양이며 지름 2cm정도이고 여러 개로 갈라지며 열편은 끝이 뾰족한 선상 피침형이고 젖혀진다.
25682,뽕나무,"지혜, 봉사","이런 말이 있다. '방귀뀌어 뽕나무, 칼로베어 피나무, 입맞춘다 쪽나무, 덜덜떠는 사시나무'. 여러 지방에서 전해 내려오는 정겨운 나무타령이다. 그럼 왜 뽕나무는 방귀뀌는 나무가 되었을까. 뽕나무의 열매(오디)는 맛이 좋은데 이 오디를 많이 먹으면 방귀를 뽕뽕 뀌게 된다. 이 때문에 조상들이 뽕나무라 불렀다고 한다.","뽕나무는 뽕나무과에 속하는 관목류이다. 아프리카, 아시아, 북미지역에 약 10종이 자생하는데 직립형인 것과 수양형인 것이 있다. 우리나라에도 산뽕나무, 뽕나무, 쳐진뽕나무 등 10종이 자생하므로 지구상에 분포하는 것은 대부분 자생한다.","수직적으로 표고 100~1,100m, 수평적으로 거의 전국에 식재.",꽃은 암수딴그루로 5월에 피고 수꽃차례은 새가지 밑부분의 잎겨드랑이에서 밑으로 처지는 꼬리모양꽃차례에 달리며 긴 타원형이다. 암꽃차례는 길이 5~10mm이고 넓은 타원형이며 암꽃은 4개이고 암술대는 거의 없으며 암술머리는 2개이고 길이2mm이며 씨방은 털이 없다.
24441,과꽃,"믿는 사랑, 추억",올해도 과꽃이 피었습니다∼♪ 라는 동요에 나오는 꽃으로 우리에게 낯익은 식물이다. 하지만 참 귀한 식물로써 세계적으로 한 종 뿐이다.,"국화과에 속하는 한해살이풀로써 세계적으로 아시아 지역에 단 1종이 분포하는 종이다. 우리나라에도 북한의 월전고원, 백두산 등의 고산지대에서 자생하고 있다.","한국 북부, 중국, 만주에 분포한다.
북부지방의 산지와 오대산에서도 자생지가 발견된다.","꽃은 7-9월에 피며 남자색이고 머리모양꽃차례는 지름 6.5-7.5cm로서 긴 화경 끝에 1개씩 달린다. 총포는 반구형이며 길이 1.5-2cm, 나비 3.5-4.5cm이고 밑부분의 엽상포는 총포조각과 비슷하며 포편은 3줄로 배열되고 외편은 긴 타원상 피침형이며 끝이 둔하고 긴 연모가 있다."
39852,말발도리,애교,초여름 산행 길에 바위에 붙어 하얗게 꽃 피운 것들과 종종 만난다. 말발도리 종류들이다. 말발도리는 꽃이 진뒤 달리는 열매가 말발굽에 끼는 편자처럼 생겼다 하여 붙여진 이름이다. 이름도 당차지만 실제 꽃이 만개했을 때 보면 참 아름답다. 가지가 바람에 날리면 꽃들이 애교를 떠는 듯 사랑스럽다. 말발도리랑 형제뻘 되는 만첩빈도리(꽃이 겹꽃으로 꽃잎이 다닥다닥 붙음)는 가지를 시원스럽게 아래로 늘어뜨려 꽃을 피운다.,"말발도리는 범의귀과에 속하는 낙엽관목이다. 세계적으로 60종이 분포하는데, 히말라야로부터 아시아 동부에 이르기까지 자생하고 있다. 우리나라에는 빈도리, 만첩빈도리, 애기말발도리, 둥근잎말발도리, 말발도리, 물참대, 바위말발도리, 매화말발도리 등 10여 종(변종)이 자생한다. ",중국; 전국적으로 분포하지만 대부분 백두대간에 분포.,"꽃은 5월 중순 ~ 6월 중순에 피고, 지름 10 ~ 12mm정도로서 백색이며 성모가 있고 편평꽃차례에 달리며 꽃받침은 통형이고 끝이 5개로 갈라지며 꽃잎도 5개로 갈라진다. 수술은 10개이고 수술대는 거의 톱니가 없으며 암술대는 3개이고 밀선반에 성모가 있다."
41557,쑥부쟁이,평범한 진리,초여름부터 피기 시작하여 가을이 깊어가도록 꽃을 피워대며 향기까지 내 뿜는다. 꽃 핀 가지들을 보면 언뜻 엉성해 보이기도 하지만 꽃잎을 보면 가지런한 것이 그렇게 질서정연할 수가 없다.,"국화과에 속하는 여러해살이 풀이다. 지구상에 약 250종이 있는데 한해살이인 것, 여러해살이인 것, 관목성인 것도 있다. 우리나라에도 10여 종이 있으며, 벌개미취는 우리나라에만 나는 한국특산종이다.",한국(남부)에 나며 일본에 분포한다. ,"꽃은 7∼10월에 연한 자색(혀꽃), 노란색(통상화)으로 핀다. 머리모양꽃차례는 가지와 줄기 끝에 산방상으로 1개씩 달리고 지름은 2.5~3cm이다. 총포는 녹색이고 공을 반으로 자른 모양이며, 포조각이 3렬로 배열한다."
26678,큰금계국,상쾌한 기분,한 여름에 고속도로든 국도든 시골길이든 운전하면서 창가를 보면 길가에 노란 코스모스처럼 무리지어 피어있는 꽃이다. 좀더 색이 진하고 꽃이 큰 루드베키아와 함께 심겨지는 것이 보통이다. 꽃이 피면 항상 하늘을 보며 방긋 웃고 있어서 보는 사람 기분을 상쾌하게 해 준다.,원래 고향은 북아메리카 남부지역에서 중앙아메리카 지역으로 자생지에 80&sim;100종 정도가 분포하고 있다. 금계국과 비슷한 것으로 꽃이 더 큰 큰금계국이 있다., ,꽃은 6-8월에 피고 황색이며 머리모양꽃차례는 긴 화경 끝에 1개씩 달리고 지름 4-6cm이며 화경은 길이 20-40cm이다. 총포조각은 2줄로 배열되고 각가가 8개씩이며 외포편은 엽상으로서 피침형 또는 긴 타원상 달걀모양이고 길이 4-8mm이며 내포편은 달걀모양이고 길이 8-13mm이다. 혀꽃은 8개이며 도삼각형 또는 거꿀달걀모양이고 길이 1.3-3cm로서 끝이  깊은 톱니처럼 갈라지며 통상화는 황색이다.
25511,나팔꽃,"풋사랑, 덧없는 사랑, 기쁨","꽃이 영락없는 나팔처럼 생겨 나팔꽃 모르는 사람은 거의 없다. 나팔꽃은 원래 우리나라가 고향은 아니며 오래전 이땅에 귀화된 식물이다. 꽃이 한 여름에 피며 꽃은 흰색, 진한 자색, 빨간색 등 다양하다. 영어이름처럼 아침에 해가 뜨면서 피는 대표적인 식물이다. 나팔꽃은 만개했을 때 보면 힘차고 기쁨에 차 있지만 꽃말처럼 불과 하루만에 피고지는 사랑이니 풋사랑이고 덧없는 사랑이다.",인도가 고향이다. 메꽃과의 한해살이 풀이다. 비슷한 것으로 둥근잎나팔꽃이 있다.,관상용으로 흔히 심고 있다.,"꽃은 남자색, 백색, 적색 등 여러 색이 있고 7~8월에 피며 잎겨드랑이에 1~3송이 달린다. 꽃받침은 5갈래로 깊게 갈라지고 열편은 좁고 길게 뾰족해지며 뒷면에 긴 털이 난다. 꽃부리는 지름 10-23cm로서 깔때기모양이다. 꽃봉오리는 붓끝모양이고 오른쪽으로 잡힌 주름이 있으며, 수술은 5개, 암술은 1개이다."
36291,달맞이꽃,기다림,"꽃은 낮에 햇볕이 있을 때 피는게 보통이지만 달맞이꽃처럼 밤에 피는 꽃(야화?)들도 있다. 달밝은 보름달을 이용해 고향(북아메리카)을 쳐다보려는 것일까, 밤새 꽃을 피우며 도대체 누굴 기다리는 것일까, 꽃말이 참 정겹다. 언제부터인지 모르지만 우리나라에 건너와 이제 우리식물처럼 산이든 들이든 마을 어귀건 전국 어디서든 잘 자라는 대표적인 귀화식물이다. 다른 이름으로 '夜來香', '月見草'라고도 불린다.","바늘꽃과에 속하며 약 125종이 아메리카 대륙에 자생하고 있다. 우리나라에는 달맞이꽃, 낮달맞이꽃, 애기달맞이꽃 등이 재배되거나 마을 주변에 저절로 자란다. ", ,꽃은 7월에 황색으로 피고 위쪽 잎겨드랑이에 1개씩 달리며 저녁에 피었다 아침에 시든다. 꽃받침조각은 4개가 2개씩 합쳐지며 뒤로 젖혀지고 꽃잎은 4개로 끝이 파지며 수술은 8개이고 암술대는 4개로 갈라지며 씨방은 원뿔모양으로 털이 있다.
34579,닭의장풀,시샘,"이름이 특이해 한번 들으면 잘 잊혀지지 않는다. 시골의 닭장근처에서 잘 자라는데다 꽃이 닭벼슬을 닮아 붙여진 이름이다. 달개비, 닭의꼬꼬, 닭의밑씻개, 닭개비, 닭이장풀 등 다양한 이름으로 불린다. 전국 어디서나 좀 습한 곳이면 눈에 띠기 때문에 귀한 대접을 못 받지만 꽃을 들여다보면 참 아름답다. 한 여름에 피는 꽃으로 꽃은 하루밖에 피어있지 못하며 참 가련해 보인다.","대표적인 일년생 풀로써 닭의장풀과에 속하며 전 세계에 100종류가 분포한다. 우리나라에는 키가 좀 작은 좀닭의장풀, 꽃이 흰색인 흰꽃좀닭의장풀이 종종 발견된다.","▶일본, 사할린, 우수리, 만주 중국에 분포한다.
▶전국 각처에 분포한다.",꽃은 7-8월에 피고 잎겨드랑이에서 나온 꽃대 끝의 포로 싸여 하늘색 꽃이 핀다. 포는 넓은 심장형이며 안으로 접히고 끝이 갑자기 뾰족해지며 길이 2cm로서 겉에 털이 없거나 있다. 외꽃덮이 3개는 무색이고 막질이며 안쪽 3개 중 위쪽의 2개는 둥글고 하늘색이며 지름 6mm이지만 다른 1개는 작고 무색이다. 2개의 수술과 꽃밥이 없는 4개의 수술이 있다.
29426,댑싸리,고백,"사실 꽃이라 부르기엔 꽃은 볼품이 없다. 잎겨드랑이에서 연한 녹색의 작은 꽃들이 이삭모양으로 모여달리기 때문이다. 원래 뜰에 심었던 것이 퍼져나간 것으로 기록되어 있다. 키는 1m정도까지 자라는데, 반듯하게 크며 가지가 많이 갈라지고 윗부분에 털이 있다. 답싸리, 비싸리, 공장이, 대싸리 등의 다른 이름이 있다.","명아주과에 속하는 식물로 중국, 러시아, 몽골, 일본에 나는 온대성 식물로 우리나라에는 2종이 자생한다. 줄기가 곧지 않고 구불구불하게 자라는 갯댑싸리는 강이나 바닷가의 모래땅에 흔히 자란다.","▶유럽, 남아시아, 중국 등지에 분포한다.
▶전국 각지에서 재배한다.",꽃은 7-8월 개화. 암수딴그루로 2-3송이씩 액출하며 꽃이 잘고 화경과 꽃잎이 없다. 꽃밑에 잎같은 포가 있고 윗부분의 잎은 흔히 포처럼 작아지기 때문에 전체가 이삭꽃차례로 되기도 한다. 양성꽃과 암꽃이 있으며 꽃받침은 5조각으로 갈라지고 꽃이 핀다음 자라서 열매를 둘러싸며 뒷면에서 날개 같은 돌기가 발달한다. 수술은 5개로 길게 꽃밖으로 나오며 꽃밥은 황색이고 씨방은 원반모양이며 끝부분의 암술대가 2개로 갈라진다.
37844,원추리,"기다리는 마음, 하루만의 아름다움","꽃이 피어 단 하루밖에 가지 않는다는 원추리, 그래서 이름도 Day lily, 하지만 한 포기에서 꽃대와 꽃봉오리가 계속 만들어지므로 포기로 보면 20-30일 정도 꽃을 볼 수 있다. 자생화들이 주변에 많이 쓰이면서 도로변에 많이 심고있는 화종 가운데 하나이다. 그래서 요즘은 자동차로 달리다 보면 어디서든 흔히 볼 수 있다.","백합과에 속하는 다년생 초본식물로 한국, 중국, 일본 등 주로 동아시아에 약 20～30종이 분포한다. 우리나라에는 왕원추리, 각시원추리 등 약 8종이 자생하고 있다. 세계적으로 개량된 원예품종들이 많이 보급되고 있는데 국내에도 식물원을 중심으로 50여 품종 이상 들어와 있다. ","▶한국, 중국, 일본 등지에 분포한다.","꽃대는 높이 1m로서 끝에서 짧은 가지가 갈라지고 6-8개의 꽃이 총상으로 달리며 6-8월경에 개화한다. 포는 선상 피침형이고 길이 2-8cm로서 윗부분의 것은 가장자리가 막질이다. 꽃자루는 길이 1-2cm로서 밑부분이 꽃대축에 붙어 있으며 꽃은 등황색이고 길이 10-13cm이며 판통은 길이 1-2cm이다. 내꽃덮이는 긴 타원형이고 둔두이며 폭 3-3.5cm로서 가장자리가 막질이다. 수술은 6개이고 판통 위 끝에 달리며 꽃잎보다 짧고 꽃밥은 선형으로서 황색이다. 꽃은 아침에 피었다가 저녁에 시들지만, 계속해서 다음 꽃이 10여송이씩 피게 된다."
29658,디기탈리스,"열애, 불성실, 화려",긴 종모양의 꽃이 여우장갑처럼 생겼다 하여 foxglove란 영명을 갖고 있다. 초여름 식물원에 가면 반 그늘진 곳에서 길쭉한 키에 주머니 모양의 꽃들을 차례로 매달고 반겨주는 꽃이기도 하다. 꽃잎에 작은 반점들도 있어 특이해 보이며 이 꽃을 별로 좋아하지 않는 사람도 있다. 꽃이 화려하며 열정적으로 피어나 꽃말과 잘 어울리는 듯 싶다. 우리나라 자생종은 아니다. ,"디기탈리스는 지구상에 약 22종이 있는데, 유럽, 아프리카 동북부, 중앙아시아 지역에 주로 분포한다. 현삼과에 속하며 학명에 손가락 모양으로 피는 보라색 꽃이란 의미가 들어있다. 이년생인 것들이 많고 영년생인 것들도 있다. 주요 원산지는 중동지역으로 우리나라에서 기르는 것들은 대부분 개량된 원예품종들이다. 꽃이 보라색인 것들이 많지만 종종 분홍색이나 흰색, 노란색 품종도 있다.",전국에 재배한다.,꽃은 7-8월에 피고 원줄기 끝에서 수상으로 발달하며 밑부분에서부터 피어 올라가고 꽃받침은 5개로 갈라지며 열편은 난상 피침형으로서 예두이다. 꽃부리는 홍자색이고 짙은 반점이 있으며 종형이지만 가장자리가 다소 순형으로 된다. 2강수술이 있고 암술머리는 2갈래로 갈라진다.
31394,참나리,기개,"하늘나리, 땅나리, 중나리..., 이 땅에 자생하는 여러 나리 중에서 진짜 나리라는 뜻으로 붙여진 참나리, 그래서 그런지 나리 중 생장이 우수하고 기골도 장대하다. 참나리는 키도 크지만 꽃도 크고 아름다워 여름철 정원용으로 매우 우수한 식물이다.","나리류(Lilium 속)는 북반구의 아열대(산간지)부터 아한대에 걸쳐 96종(아시아 59종, 북미 25종, 유럽 12종)이 자생한다. 일본에는 관상가치가 높은 7종을 포함하여 15종이 있고 세계적인 유전자 원산지이기도 하다. 중국, 한국, 시베리아지역에도 관상가치가 높은 것이 많고 화훼로 중요한 나리는 모두 이 지역에 분포한다. 우리나라에는 참나리, 중나리, 하늘나리, 날개하늘나리, 솔나리, 땅나리, 털중나리, 섬말나리, 말나리, 하늘말나리 등 10종이 자생한다.",거의 전국적으로 분포한다.,꽃은 7-8월에 피고 가지끝과 원줄기끝에 4-20개가 밑을 향해 달린다. 화피열편(花被裂片)은 피침형 또는 넓은 피침형이며 길이 7-10㎝로서 짙은 황적색 바탕에 흑자색 반점이 산포하고 뒤로 말린다. 밀구(蜜溝)에 짧은 털이 있으며 6개의 수술과 암술이 꽃 밖으로 길게 나오고 암술대는 길며 꽃밥은 짙은 적갈색이다.
31560,목화,"어머니의 사랑, 당신은 기품이 높다.",원래 섬유작물로써 우리나라에서는 솜을 짜기 위해 목포 등 남부지역에서 예전에 흔히 재배했다. 요즘은 학습용이나 관상용 정도로 허브원이나 토종식물 공원(생태원)에 심겨있는 정도다. 목화의 꽃말은 고향에 가면 언제나 푹 느낄수 있는 어머님의 포근한 사랑과 애틋한 마음을 담고 있다.,목화는 아욱과에 속하는 일년초 식물이다. 농촌진흥청에서 90년대초까지 신품종을 육성 보급한 바 있다.,중부지방 및 남부지방에 분포한다.,꽃은 8~9월에 피며 액생하는 꽃자루 끝에 1개씩 달리고 지름 4cm 내외이다. 꽃밑에 엽상의 작은포가 3개 있으며 삼각상 달걀모양으로서 자줏빛이 돌고 날카로운 톱니가 있다. 꽃받침조각은 술잔 같으며 녹색 잔점이 있고 작으며 꽃잎은 5개가 기와장을 인 모양으로 나열되고 연한 황색 바탕에 밑부분이 흑적색이며 수술은 많고 단체(單體)이다.
31548,무궁화,"은근, 끈기, 섬세한 아름다움","나라꽃 무궁화다. 꽃색은 순백색인 것부터 단심, 분홍단심, 홍단심 등 다양하며 복색인 것도 있다. 꽃도 단아한 홑꽃부터 겹꽃, 반겹꽃 등 변이도 많다. 여름내내 꽃을 피운다. 사실 여름철 꽃을 관상할 수 있는 화목류로써 무궁화만한 것도 드물다. 꽃 하나는 수명이 짧지만 꽃대가 계속 나와 두세달 꽃이 계속 핀다. 여름이면 길가에 큰 꽃이 피는 부용이나, 미국부용, 하와이무궁화 등이 모두 히비스커스에 속한다.","무궁화를 서양에서는 히비스커스라 하는데 여기에 속하는 식물도 무척 다양하다. 약 200 종 이상이 온대, 열대, 아열대 지역의 강 주변이나 암석 사이에서 집중적으로 분포한다. 안타깝게도 우리나라에는 자생하고 있는지가 명확치 않은 실정이다.",평남 및 강원도 이남에서 식재.,"꽃은 8 ~ 9월에 피며 1개씩 달리고, 지름 6 ~ 10cm로 보통 분홍색 내부에 짙은 붉은색이 돌고, 꽃받침조각은 달걀상 피침형으로 별모양 털이 있고, 외부에 꽃받침보다 짧은 선상의 바깥 꽃받침이 있다. 꽃잎은 거꿀달걀형으로, 5개가 밑부분에서 서로 붙고, 수술은 한몸수술이며 암술대가 수술통 중앙부를 뚫고 나온다."
