id,name,flower_lang,info,type,native,flower
28145,양지꽃,봄,"꽃샘추위가 옷깃을 여미게 하는 날에도 산기슭이나 길가 양지바른 곳을 보면 어김없이 활짝 웃고 있는 노란 꽃이 있다. 따사로운 봄 햇살을 받으며 환하게 웃는 모양이 우리에게 봄은 이미 아주 가까이 왔음을 알리는 듯 하다. 봄을 알리는 꽃 중에서 복수초, 노루귀 같은 것들은 꽃이 먼저 피지만 양지꽃은 잎이 먼저 나온 뒤 꽃이 핀다.","장미과의 여러해살이 풀이다. 우리나라를 비롯하여 중국 북동부, 일본, 시베리아 등지에 분포한다. 비슷한 것으로 개소시랑개비와 제주양지꽃이 있다.","한국, 일본에 분포한다.
전국의 산야에 자생한다.","개화기는 4~6월이며, 화경이 길게 자라 그 끝에서 집산상으로 황색 꽃이 핀다. 꽃의 직경은 15~20mm로 꽃받침의 길이보다 1.5~2배 정도 길다. 꽃받침의 조각은 5개이고, 끝이 뾰족하며 부꽃받침은 꽃받침과 크기가 같거나 작다. 꽃잎은 도란상 원형이고, 약간 끝이 오목하다. 꽃턱에는 털이 있다. 암술과 수술은 여러 개이다."
28560,솜방망이,안전합니다.,풀 전체가 은색 털로 덮여 있고 긴 꽃대 끝에 피어있는 꽃 전체의 형태가 둥근 모양새를 띠고 있어서 솜방망이라는 이름을 얻은 것 같다. 꽃대가 위로 곧추 서 쓰러질 것 같지만 대가 튼튼해 꽃말처럼 쓰러지지 않는다.,"국화과의 여러해살이풀이다. 종류는 산솜방방이, 민솜방망이 등이 있다. 전국의 햇볕이 드는 곳이면 어디서나 볼 수 있다.","▶한국, 일본 등지에 분포한다.
▶전국에 분포한다.","꽃은 5-6월에 피고 지름 3-4cm로서 3-9개가 산방상 또는 산형 비슷하게 달리며 화경은 길이 1.5~5cm로서 백색 털로 덮여 있다. 총포는 통형이고 길이 8mm, 폭 11mm이며 비늘잎은 끝이 뾰족한 피침형이고, 혀꽃은 1줄로 배열되는데 길이가 12-16mm, 폭은 2~3mm로 황색이다."
21703,팬지,"쾌활한 마음, 나를 생각해 주세요.",팬지의 어원은 프랑스어의 ‘생각하다(Penser)’이다. 정말 생각하는 사람의 얼굴 같은지 팬지 꽃을 한번쯤 가만히 들여다보자. 이른 봄 도로가에서 많이 볼 수 있다.,"제비꽃과에 속하는 식물이며 세계적으로 약 300여 종이 지중해를 중심으로 분포한다. 우리 산야에 지천으로 널려 있는 제비꽃이 팬지의 조상뻘이다. 팬지는 세계적으로 수없이 많은 품종들이 개발되어 나오고 있으며, 우리나라에서는 초가을에 씨앗을 뿌려 이른 봄 화단이나 길가에 내다 심는 전형적인 추파일년생 초화류로 취급되고 있다.",국내 각지에서 관상용으로 재배한다.,"4~5월에 자색, 황색, 백색의 꽃이 같이 피며 잎겨드랑이에서 긴 화경이 나와 그 끝에 한개의 꽃이 옆을 향해 달린다. 꽃받침조각은 5개로서 녹색이고 꽃잎도 5개로서 둥글며 옆으로 퍼지고 고깔부가 짧으며 5개의 수술과 1개의 암술이 있다."
29587,황매화,"숭고, 고귀, 왕성",진한 노란색 꽃이 줄기를 따라 피어 있는 모습이 무척 인상적이며 상록성이 아닌데도 사철 줄기가 초록색이어서 더 기억에 남는 나무이다. 꽃이 노란색으로 매화꽃을 닮았다 하여 황매화라 한 것 같다.,"장미과의 낙엽성소관목이다. 중국, 일본이 고향이며 우리나라에서는 중부이남지역에서 관상용으로 흔히 재배되고 있다. 꽃은 홑꽃으로 꽃잎이 다섯 장을 기본으로 하는데 꽃잎이 겹꽃인 것은 '죽단화(K. japonica for. plena)'라고 한다. 황매화는 가을에 검은색 열매를 맺지만 죽단화는 열매가 열리지 않는다.","▶일본, 중국에도 분포한다.
▶전국 각지에 분포한다.",꽃은 완전화로서 가지 끝에 1개씩 피며 지름 3-4cm이고 황색이며 측지끝에서 잎과 같이 피고 꽃자루는 길이 2cm에 달한다. 꽃받침조각은 5개이고 달걀모양 첨두로서 털이 없으며 잔톱니가 있고 꽃잎은 5개이며 달걀모양 또는 난상 원형이고 수술은 많으며 암술대와 길이가 비슷하고 심피는 5개(간혹 8개)이며 4-5월에 개화한다.
36738,히아신스,"마음의 기쁨, 승리",꽃에는 늘 전설이 있게 마련이다. 히야신스는 그리이스의 아름다운 청년 Hyacinthus의 영혼이 담긴 꽃이라고 한다. 학명의 orientalis는 동양이 원산지라는 의미이다. 꽃에서 나는 달콤한 향기가 일품으로 알뿌리 중에서는 튜립이나 수선화 다음으로 많이 쓰인다.,"백합과의 가을에 심는 알뿌리다. 껍질이 있는 인경으로 추위에 잘 견딘다. 세계적으로 30여종이 열대아프리카, 남아프리카, 지중해 연안 및 아시아 서부에 주로 분포한다.",관상용으로 재배하고 있다.,이른 봄 잎사이에서 꽃대가 자라 잎보다 약간 길어지며 윗부분에 꽃이 총상으로 달린다. 꽃은 옆을 향하고 깔대기 모양이며 지름 2-3㎝로서 청자색이지만 다양하다. 화피 윗부분은 6개로 갈라지고 열편은 육질이며 수평으로 벌어진다. 수술은 6개로서 판통 위쪽에 붙지만 밖으로 나타나지 않는다.
26466,피나물,보이는 것이 전부가 아닙니다.,완연한 봄으로 들어설 무렵 숲속계곡을 지나다 보면 노란색 군락으로 향연을 펼치는 꽃이 있다. 겉에서는 안보이지만 줄기를 자르면 노란 빛을 띤 붉은 유액이 나온다하여 피나물이라 불리는 꽃이다. 군무를 펼치듯 무리지어 있는 모습을 보면 어느 누구든 감탄하고 만다.,양귀비과의 여러해살이 풀이다. 숲 속 그늘진 곳이나 계곡 주변 습기가 많은 곳에 군락으로 자생한다. 유사한 식물로 노랑매미꽃이 있는데 피나물은 한 꽃대에 꽃이 하나씩 피고 노랑매미꽃은 2~3개씩 모여 피는 것이 다르다.,"▶한국, 만주, 일본 등지에 분포한다.
▶경기도 이북 산지에서 자생한다.","4~5월에 선명한 황색 꽃이 피며, 원줄기 끝의 잎겨드랑이에서 1~3개의 긴 화경 (花莖)이 나오고 끝에 1송이씩 달린다. 화경에 몇 개의 잎이 달린다. 꽃받침조각은 2개로 달걀모양이며 길이 16mm 정도로서 일찍 떨어지고 꽃잎은 4개이며 난상 원형이고 길이 2.5cm로서 윤채가 있는 황색이며 그 속에 많은 수술과 1개의 암술이 있다."
29034,삼지닥나무,당신을 맞이합니다.,"한지의 원료식물로 닥나무, 삼지닥나무, 황촉규, 산뽕나무 등이 있는데, 이들 중 삼지닥나무는 일본에서 화지를 만드는데 주로 쓰인다고 한다. 봄에 잎이 나기 전 꽃이 먼저 피는데 벌집을 매단듯한 모양의 노란 꽃이 예쁘고 향도 달콤하다. 나뭇가지가 셋으로 갈라진다 하여 삼지닥나무라 불린다.","팥꽃나무과의 낙엽활엽수 관목이다. 국내에서 자생지는 확인된 바 없고 전라도, 경상도 및 제주도에 심고 있다.","전라남도, 경상남도 및 제주도에 식재.","가을철 잎이 떨어질 무렵에 가지 끝에서 1~2개의 꽃봉오리가 생기고, 4월에 잎보다 먼저 둥글게 모여 피고 노랑색으로 길이는 1cm이며, 꽃받침은 통형이며 4개로 갈라지고, 길이 12 ~ 14mm로 겉에 흰색의 잔털있으며, 열편은 타원형이고 길이는 5mm이다. "
22938,노루귀,"위로, 인내",숲에서 앞만 보고 가는 사람은 볼 수 없는 꽃이다. 노루귀는 키가 작고 바닥에 바짝 붙어있기 때문이다. 가끔은 아래도 살피고 가야 곱디고운 색감의 작은 꽃들을 관찰할 수 있다. 하얀 털을 뒤집어쓰고 꽃대가 나오면 꽃잎과도 같은 꽃이 피어나고 그 꽃이 질 무렵 잎이 나오는데 말려있는 모양이 노루위 귀를 닮아 붙여진 이름이다.,미나리아재비과의 여러해살이풀이며 적응력이 좋아 사는 곳에 따라 다양한 변화를 보인다. 꽃색도 어느 것에 뒤지지 않고 잎 모양도 좋다. 한 가지 흥미로운 것은 씨앗을 통해 나온 개체들은 변이가 매우 다양하다는 사실이다. 실제 자생지를 보면 형태가 같은 것들은 상당히 드물다. 이것은 노루귀가 특히 타식율(타가수정되는 비율)이 높다는 것을 말해주는 것이다.,"전국 각지에서 자란다.-- 제주, 서울(북한산), 전남, 전북(덕유산), 경남, 충남(계룡산), 충북, 강원, 경기(광릉, 가평, 와야산, 천마산), 평북 함남에 야생한다.","꽃은 4월에 아직 잎이 나오기 전에 피며 지름 1.5cm정도로서 백색 또는 연한 분홍색이고 화경은 길이 6-12cm로서 긴 털이 있으며 끝에 1개의 꽃이 위를 향해 핀다. 총포는 3개이고 달걀모양이며 길이 8mm, 폭 4mm로서 녹색이고 백색털이 밀생하며 꽃받침조각은 6-8개이고 긴 타원형이며 꽃잎같다. 꽃잎은 없고 수술과 암술은 많으며 황색이고 씨방에 털이 있다."
30528,미선나무,모든 슬픔이 사라진다.,"봄을 대표하는 꽃 중 길가를 노랗게 만드는 개나리를 모르는 사람은 없다. 하지만 꽃모양은 개나리와 비슷하면서 은은한 향도 있고 가을 열매도 예쁜 우리나라의 특산식물이 있다는 것을 아는 사람은 그리 흔치 않다. 동화책에 보면 궁중 시녀들이 임금님 옆에서 모양이 동그란 부채를 들고 있는 모습이 있는데, 이 그림에 나오는 부채처럼 생긴 열매를 가진 나무가 바로 미선나무기도 하다.",물푸레나무과의 낙엽활엽관목이다. 충북 괴산과 진천지역이 자생지로 법으로 보호되고 있다. 유사한 종으로 미선나무에서 유래된 분홍미선나무를 제외하면 세계적으로 1종 1속밖에 없는 희귀종으로 우리나라가 유일한 자생지다.,"충청북도, 전라북도 지역 전석지, 한반도 고유종.","꽃은 전년도에 형성되었다가 잎보다 먼저 피며, 총상꽃차례로 꽃은 자주색이며 길이는 3 ~ 4mm이다. 꽃받침은 종상 사각형으로 떨어지지 않고 길이는 3 ~ 3.5mm이고, 열편은 4개이며 꽃부리는 꽃받침보다 길며 흰색, 연한 노란색 또는 약간 붉은색 등으로 3월 중순 ~ 4월 초순에 개화한다."
22924,할미꽃,공경,세월의 무게를 이기지 못하여 허리가 굽어지고 하얗게 세 버린 머리를 빗어 곧게 틀어 올리려고 해도 흩어져버리는 할머님의 뒷모습을 보면 '백두옹‘이라는 말이 생각난다. 백두옹은 할미꽃의 다른 말이기도 하다.,"미나리아재비과의 여러해살이풀이다. 세계적으로 약 30종이 자생하는데, 우리나라에는 가는잎할미꽃, 분홍할미꽃, 할미꽃, 산할미꽃, 동강할미꽃 등 5종이 있다.",전국 각처의 산야에 분포한다.(제주도를 제외한 한반도 전역에 분포),"꽃은 4월에 피고 높이 30-40cm의 꽃대가 나와 끝에 1개의 꽃이 밑을 향해 달리며 작은포 는 화경 윗부분에 달리고 3-4개로서 다시 잘게 갈라지며 겉에 화경과 더불어 긴 백색털이 밀생한다. 꽃받침 열편은   6개이고 긴 타원형이며 길이 35mm, 폭 12mm로서 겉에 명주실같은 백색 털이 밀생하나 안쪽에는 털이 없으며 적자색이다."
37868,얼레지,여인,"야생화 하면 보통은 ‘수수함’이나 ‘소박함’을 연상하게 되는데, 그런 수식어와는 좀 거리가 먼 화려한 꽃이 있다. 꽃잎을 뒤로 맘껏 젖힌 모양새가 기품이 넘치는 여인처럼 보이는 얼레지가 그것이다. 자생지에서 보면 대 군락을 이루는 경우가 많아 계곡이나 능선 전체가 장관을 이룬다.",백합과의 여러해살이풀로써 고산지역 계곡 주변에 집단으로 자생한다. 흰색의 변이종도 볼 수 있다.,"▶한국, 일본, 중국 등지에 분포한다.
▶전국의 주로 높은 산악지대에서 자란다.","봄철에 길이 25cm의 꽃대가 나오고 그 밑부분에 2개의 잎이 지면 가까이에 달린다. 꽃은 4월에 피며 화경끝에 1개의 꽃이 밑을 향해 달린다. 꽃잎은 6개이고 피침형이며 길이 5-6㎝, 폭 5-10mm로서 뒤로 말리고 자주색이지만 안쪽 밑부분에 더욱 짙은 W자형의 무늬가 있다. 수술은 6개이며 길이가 서로 같지 않고 꽃밥은 자주색이며 길이 6-8mm로서 넓은 선형이고 암술머리는 3개로 갈라진다."
33237,각시붓꽃,"부끄러움, 세련됨",각시 라 하면 이제 막 시집 온 새색시를 연상케 한다. 그래서인지 여러가지 붓꽃들 중에서 각시붓꽃은 바라볼수록 다소곳함과 소박함이 느껴지는 꽃이다. 길고 곧게 뻗은 가는 잎도 한층 분위기를 더한다.,붓꽃과의 여러해살이풀로써 전국의 습기가 유지되는 곳이면 흔히 자생한다. 붓꽃 중 키가 작은 편으로 꽃이 진 후 잎이 더 길게 자란다.,전국의 산지에 분포하고 중국 동부와 일본 남부에 분포한다.,"꽃은 4~5월에 피고 꽃대 선단에 지름 3.5-4cm로서 자주색이며 판통은 길이 4-6cm이고 화경은 높이 5-15cm로서 4-5개의 포가 있으나 가장 위의 포에서 1개의 꽃이 핀다. 포는 녹색이며 길이 4~6cm로서 선형이고 예첨두이며 꽃자루는 길이 8mm로서 씨방보다 길다. 외꽃덮이는 좁은 거꿀달걀모양이고, 중앙부에 두드러진 돌기가 없으며 밑부분이 뾰족하고 내꽃덮이는 곧추서며 약간 짧다. 꽃밥은 황색이고, 길이 4mm로서 수술대보다 짧으며 암술대는 3개로 갈라진 다음 다시 끝이 2개로 깊게 갈라진다."
27997,바람꽃,"당신만이 볼 수 있어요, 덧없는 사랑",‘바람의 딸’이라는 이름과 걸맞게 바람과 가까운 높은 곳에 보금자리가 있다. 우리나라 바람꽃 종류는 대부분 봄에 피지만 오늘의 바람꽃만은 유일하게 여름에 꽃을 피운다. 그러니 이 봄이 바람꽃에게는 새로운 잉태를 위한 준비기간일 듯 싶다.,"미나리아재비과의 여러해살이풀로써 중, 북부지역의 고산지대에 습도가 웬만큼 유지되는 곳에서 흔히 자생한다. 우리나라에 자생하는 종으로 꿩의바람꽃, 회리바람꽃, 홀아비바람꽃 등 15종류의 바람꽃이 있다.","일본, 중국, 러시아, 미국, 유럽 / 한국(강원도 속초시, 양양군, 인제군) ",꽃은 7-8월에 피고 백색이며 화경은 1-4개이고 꽃자루는 5-6개가 산형으로 나와 꽃이 1개씩 달린다. 꽃받침조각은 5-7개이며 길이 12-15mm로서 달걀모양 또는 타원형이다. 총포조각은 길이 2-4cm로서 선형으로 갈라진다.
30525,개나리,희망,"개나리, 봄을 알리는 전령사 하면 가장 먼저 떠오르는 꽃이다. ‘나리나리 개나리 잎에 따다~’ 또는 ‘개나리 노란 꽃그늘 아래~’ 라는 아이들의 노래처럼 4월 수십 개의 가지에 노란색 꽃이 다닥다닥 붙어 피는 모습이 보는 사람에게 따스함을 가득 선사해 준다.","물푸레나무과에 속하는 낙엽성 관목이다. 대표적인 우리 자생식물 중의 하나로써 함경도를 제외한 전 한반도에 걸쳐 두루 자생한다. 개나리와 유사한 것으로는 꽃이 일찍 피는 '만리화', 꽃이 연한 황색인 '산개나리', 열매를 약용으로 쓰는 '의성개나리' 등이 있다.",평안남도 이남 전역에 식재.,"꽃은 3월 ~ 4월에 피고 밝은 노란색이며 잎겨드랑이에 1 ~ 3개씩 달리고, 꽃받침은 4갈래로 갈라지며,  꽃부리 길이는 1.5 ~ 2.5cm로 깊게 4개로 갈라진다."
37874,애기나리,요정들의 소풍,산행 중 완만하게 경사진 언덕에서 잠시 쉬다보면 잎은 둥굴레를 닮았으나 꽃은 나리를 닮은 자잘한 식물체가 군락으로 펼쳐져 있어 지친 산행을 위로해 줄 때가 있다. 꽃은 나리꽃 같지만 키가 작아 애기나리라고 불리는 풀이다.,백합과의 여러해살이풀이다. 전국 활엽수림 주변의 경사가 완만한 지역에 자생한다.,중부 이남의 산지에 분포한다.,꽃은 4-5월에 피며 가지끝에 1~2개의 연한 녹색꽃이 밑을 향해 달리고 꽃자루는 길이 1-2cm이며 꽃잎은 길이 15-18mm로서 6개가 비스듬히 퍼지고 끝이 날카로운 피침형으로 된다. 수술은 6개로서 화피밑에 달리며 수술대는 길이 5-6mm이고 편평하며 기부가 넓다. 꽃밥은 황색이고 수술대 길이의 약 1/2이며 긴 타원형이고 씨방은 달걀모양으로서 3실이고 암술대는 길이 5-7mm로서 끝이 3개로 갈라지며 암술머리는 3개이다.
24143,금낭화,당신을 따르겠습니다,아치형으로 활대처럼 곧게 뻗은 꽃대에 아이들 복주머니 모양의 진분홍색 꽃들이 주렁주렁 달려있는 꽃이다. 꽃 모양이 옛날 며느리들이 차고 다니는 주머니를 닮았다 하여 며느리주머니 라고도 부른다. 어찌 보면 말괄량이소녀 ‘삐삐’의 머리를 닮은 것 같기도 하다.,현호색과의 여러해살이풀이다. 지금까지 재배되던 것은 귀화식물로 알려져 왔으나 90년대 후반 전북 완주에서 수십만 개체가 군락으로 발견되어 우리나라에도 원래부터 자생하고 있었음을 강하게 뒷받침 해주고 있다. 유사종으로 흰금낭화가 있다.,"▶한국, 중국 등지에 분포한다.
▶천마산, 가평, 설악산 등지의 중부지역 산지에서 자생한다.","꽃은 5-6월에 피며 연한 홍색이고 길이 2.7~3cm, 폭 1.8~2cm로서 밑부분이 심장저이며 원줄기 끝의 총상꽃차례에 한쪽으로 치우쳐서 주렁주렁 달리고 꽃차례는 원줄기 끝에서 발달하여 길이20~30cm로 활처럼 굽는다. 꽃받침조각은 2개로 피침형이며 끝이 둔하고 길이 6~7mm로서 빨리 떨어지며, 꽃잎은 4개가 모여 편평한 심장형으로 되고 바깥 꽃잎 2개는 길이 2cm 정도로서 밑 부분이 주머니 같은 거(距)로 되며 끝이 좁아져서 바깥쪽으로 젖혀지고 안쪽 꽃잎 2개는 합쳐져서 돌기처럼 되며 길이 2.5cm 정도로 백색이다. 수술은 6개가 양체(兩體)로 갈라지고 암술은 1개이다."
28944,매실나무,"깨끗한 마음, 결백",봄에 구례와 하동을 잇는 섬진강변 도로를 지나다 보면 양쪽 산자락에 하얗게 핀 매실나무들을 쉽게 볼 수 있다. 이제 이 매화꽃길은 봄이 오면 많은 사람들이 찾는 주요 관광명소가 되어 있다. 꽃길을 따라가다 보면 매화마을을 만나는데 이 곳의 매화군락은 그야말로 한 폭의 수채화를 연상하게 할 만큼 아름답다. 매화는 사군자로서의 기품과 향기도 지니고 있다.,장미과의 낙엽성 작은 키 나무이다. 중국원산으로 남부지방에서 많이 재배되고 있으며 꽃은 4월경에 잎보다 먼저 피는데 흰색에 가까운 녹색으로 향기가 강하다. 개나리처럼 줄기에 꽃눈이 가을에 만들어져 겨울을 지나면서 잠을 잔 뒤에 봄에 온도가 올라가면서 꽃이 핀다.,"▶일본, 대만, 중국에도 분포한다.
▶전남, 전북, 경남, 충남, 충북, 경기, 황해도에서 야생 또는 재배한다.",백색 또는 담홍색으로 4월에 잎보다 먼저 피고 전년도 잎겨드랑이에 1-3개씩 달리며 화경이 거의 없다. 지름 2.5㎝내외로 향기가 강하고 색깔이 다양한데 기본종은 분홍색이다. 꽃받침은 5개로 자갈색의 타원형이며 원두이다. 꽃잎은 넓은 거꿀달걀모양으로 끝이 둥글고 많은 수술이 울타리처럼 1개의 암술을 보호하고 있다. 씨방에 밀모(密毛)가 나 있다.
27785,천남성,현혹,이름만 들으면 남녘하늘 어디쯤 있는 별 이름 같지만 이 식물을 처음 본 사람은 고개를 바짝 쳐든 뱀을 연상하기도 한다. 실제로 꽃을 싸고 있는 포가 뱀의 머리모양을 닮았다하여 ‘사두초’라고도 불린다. 긴 통모양의 포와 가을에 붉게 익는 타원형 열매가 관상가치가 크다.,천남성과의 여러해살이풀이며 산지의 반그늘지고 습윤한 곳에 자생한다.,한반도 전역,꽃은 5∼7월에 피고 육수꽃차례로 달린다. 불염포는 판통의 길이 8cm 정도이고 녹색이며 윗부분이 모자처럼 앞으로 꼬부라지고 난상 장타원형으로 끝이 뾰족하다. 꽃차례의 부속체는 곤봉형이다.
23641,목련,자연에의 사랑,"‘오 내 사랑 목련화야, 그대 내 사랑 목련화야...’, ‘하얀 목련이 필 때면 생각나는 사람...’, ‘목련꽃 그늘아래서 베르테르의 편지를...’ 등등 목련꽃을 좋아하는 마음을 표현한 노래와 시들이 많은걸 보면 동서양 모두 좋아하는 것 같다. 나무위에 피는 연꽃이라 부르는걸 보면 순백의 자태가 고결함마저 느껴진다. 학명 중 ‘kobus'는 ’주먹‘을 나타내는 말로 꽃 피는 모양이 주먹을 쥐었다 펴는 모양을 닮은데서 유래한다.","목련과에 속하는 낙엽성 교목이다. 우리나라에서 목련이라 함은 제주가 자생지인 목련과 북한의 국화인 함박꽃나무(산목련)가 있다. 중부 이남지역의 화단, 공원 및 도로변에 흔히 심겨진 것을 볼 수 있는데, 이것은 자생목련이 아니라 중국에서 들여온 백목련이나 자목련이 대부분이다.","일본; 제주도 숲속 자생, 전국 식재.","양성꽃으로서 3~4월 중순부터 잎이 나오기 전에 피고 지름 10cm정도이며 6개의 꽃잎은 백색(백목련은 9개)이지만 기부는 연한 붉은색이고(백목련도 백색이나 기부에 담홍색은 없음) 향기가 있으며 길이 5~8cm정도로서 6~9개이고 긴 타원형이다. 꽃받침조각은 3개이며 선형이고 길이 1.5~2.5cm,폭 3~4㎜로서 일찍 떨어지며 수술은 30 ~ 40개이고 꽃밥과 수술대 뒷면이 적색이다. 암술의 꽃밥은 붉은 자주색을 띤다. 꽃이 활짝 피어 편평하게 펴져서 산만한 감을 준다. 보통 꽃의 기부에 1개의 어린잎이 붙어 있어(백목련은 없음) 백목련과 구별할 수가 있다."
39881,박태기나무,"우정, 의혹","박태기나무를 일컫는 말은 여러 가지가 있다. 밥을 튀겨놓은 ‘밥티기’를 닮았다 하여 박태기나무, 꽃봉오리가 구슬을 닮았다하여 북한에서는 ‘구슬꽃나무’라 부르며, 유다가 목을 매어 죽었다 하여 ‘유다나무’라고도 한다. 꽃자루가 없어 진분홍 꽃이 가지를 감싸 안듯 치장을 하지만 꽃에는 독이 있다.",중국원산이며 지구상에 약 6종이 분포하고 있다. 콩과에 속하는 식물로 낙엽성의 키작은 나무이며 키는 3∼5m 정도로 작게 자란다. 꽃은 4월 하순에 자홍색으로 가지의 마디부분에서 10여 개씩 다닥다닥 모여 핀다. 이른 봄에 피는 많은 목본성 식물들처럼 잎보다 꽃이 먼저 나온다.,중국; 관상용으로 널리 식재.,"꽃은 4월 하순에 잎보다 먼저 피며 길이 1.2 ~ 1.8cm로 홍자색이며, 7 ~ 8개(20 ~ 30개)씩 우상모양꽃차례를 이루고, 꽃대가 없으며 작은꽃대의 길이는 6 ~ 15mm로,  2/3 정도에 마디가 있어 부러지며 기꽃잎은 길이 8 ~ 10mm이고, 용골꽃잎은 나비 5mm이다.  수술 연한 붉은색으로, 길이는 10 ~ 12mm이다."
33608,배나무,환상,‘배꽃 피는 거 보면 벚꽃구경 갈 필요가 없다’라는 말이 있을 정도로 아름답다. ‘이화에 월백하고...’라는 시조에도 나오듯이 그 운치가 한껏 묻어나옴을 느낄 수 있다. 한입 베어 물면 입안가득 고이는 그 향과 시원함의 배 맛 또한 어찌 잊을 수가 있겠는가~,"배는 크게 동양배(일본배, 중국배), 서양배로 나누는데,이 중 우리가 보통 즐겨먹는 것은 동양배이다. 우리나라에서는 삼한시대와 신라의 문헌에 배에 관한 기록이 있고, 고려시대에 배 재배를 장려했다는 기록을 보면 배에 관한 역사는 길다. 장미과의 낙엽활엽수이며 꽃은 4∼5월에 피는데 백색 바탕에 작은 분홍색 무늬들이 들어 있어 아무리 보아도 지루하지 않고 보면 볼수록 꽃의 생김새에 매력을 느낄 수 있다. 우리나라에서 생산된 배는 맛이 좋아 현재 상당량이 외국으로 수출되고 있다. 품종도 옛날에는 장십랑, 신고 중심의 배에서 요즘은 감천배, 영산배...등 맛이 훨씬 뛰어난 품종들이 많이 개발(농촌진흥청 원예연구소)되고 있다. 특히 황금배는 맛과 품질이 뛰어나 수출용 품종으로 많은 각광을 받고 있다.","일본 원산, 전국 식재.","꽃은 5월에 피며 백색이고 양성꽃이며, 총상꽃차례를 이룬다.  꽃차례는 털이 없거나 면모가 있고 꽃은 지름 3cm정도이며 꽃받침조각은 긴 점첨두이고 꽃잎은 난상 원형이며 암술대는 4~5개로서 털이 없다."
