id,name,flower_lang,info,type,native,flower
31608,향나무,영원한 향기,"향나무는 상록침엽수로 우리나라에서 가장 오래 사는 나무 중의 하나이다. 예로부터 마음을 담아 기원을 하는 나무로 소중히 여겨왔으며 관상, 약용, 향료, 조각재 등으로 널리 이용되어 왔다. 목질도 단단하려니와 목재의 향과 색이 일품인 이유로 보인다. 울릉도 도동에 사는 향나무는 2,500년생으로 세계에서 가장 오래된 것으로 전해지고 있다.","측백나무과 향나무속에 속하며 전국에 자생 또는 식재되어 있다. 종류는 자생하거나 흔히 심겨져 있는 향나무, 줄기가 누운 형태로 자라는 눈향나무, 고산지대에서만 자라는 곱향나무, 가지가 수평으로 퍼지는 뚝향나무, 북아메리카원산인 연필향나무 그리고 가지가 나선모양으로 돌아가는 가이쓰가향나무가 있으며 주로 이용되는 것은 가이쓰가향나무와 연필향나무다.","울릉도, 의성, 삼척, 영월 등에 자생 및 전국에 식재","개화기는 4월, 암수딴그루, 수꽃은 타원형이며, 길이 2.8~5.1mm이고, 연한 자갈색이며, 인편의 안쪽에 4~6개의 꽃밥이 있다. 암꽃은 구형이고, 길이는 1.5mm 정도이며, 밖에 4개의 황록색 인편이 있고, 안쪽에는 2쌍의 실편이 있다. 화분은 크기가 30μm 정도이며, 발아구는 화분립 표면에 렌즈형으로 발달하며, 화분체의 표면은 과립상의 돌기물들이 분포한다."
29259,나도풍란,인내,"남부지역의 바위나 나무에 붙어사는 난이다. 보통 풍란 하면 소엽풍란을 말한다. 나도풍란은 잎이 넓은 대엽풍란이다. 자연 상태에서는 6년 정도가 지나야 꽃을 피우는데, 그 향기가 진하여 취할 정도로 좋다. 꽃말은 바닷가의 바위에 붙어 모진 풍파를 이겨내며 자라기 때문에 붙여진 듯 하다.","난과의 상록다년초이다. 히말라야, 말레이시아, 스리랑카, 일본, 중국 등에서 자생한다. 우리나라에서는 제주와 전남, 남해안의 따뜻한 섬지방에서 자생하나 지금은 멸종위기에 놓여있다. 원예연구기관에서 조직배양묘를 생산하여 자생지 복원사업을 추진하여 성공단계에 와 있다.",일본 / 한국(전라남도 신안군) ,꽃은 6-8월에 피고 연한 녹백색이며 꽃대는 옆에서 나오고 길이 5-12cm로서 4-10개의 꽃이 총상으로 달린다. 포는 달걀모양이며 길이 4~5mm로서 끝이 둔하고 꽃받침조각은 긴 타원형이며 길이 11~13mm로서 끝이 둔하다. 꽃잎은 꽃받침보다 짧고 입술모양꽃부리는 꽃받침과 길이가 비슷하며 3개로 갈라지고 거꿀달걀모양에 원두이다. 측열편은 작고 중앙열편은 도란상 쐐기모양이며 끝이 둥글고 빗살같은 톱니가 있으며 측열편과 더불어 연한 홍색 반점이 있다. 거(距)는 통같고 안으로 굽는다.
29141,군자란,고귀,君子蘭(군자란)은 이름 끝에 ‘란’이라고 되어있어서 난 종류일거라 생각하기도 하지만 난과는 전혀 관계없는 식물이다. 이름은 동양적지만 고향은 남아프리카이다. 잎을 주로 관상하는 관엽식물이지만 긴 꽃대 끝에 여러 송이가 함께 피는 꽃 모양이 매우 아름답다. 겨울철 꽃이 참 귀할 때인데 비록 실내이긴 하지만 꽃을 보여주니 참 고귀하다는 생각이 든다.,"수선화과에 속하는 상록성의 다년생 식물로써, 강변이나 숲 속의 물기가 충분히 있는 곳에 자생하며 세계적으로 4종이 분포한다. 우리나라에는 주로 미니아타종이 있다.",온실에서 널리 재배한다.,잎 사이에서 편평하고 굵은 꽃대가 나와 끝에 12-20개의 꽃이 위를 향해 산형으로 달린다. 꽃자루는 꽃대와 더불어 녹색이며 꽃은 넓은 깔때기 모양으로서 내면은 주홍색이고 목부분은 황색이다. 화피열편은 6개로서 외꽃덮이가 내꽃덮이보다 좁으며 뒷면 주맥은 짧은 판통과 더불어 녹색이고 수술은 6개이다. 온실에서는 3월부터 꽃이 피기 시작하며 분주 또는 종자로서 번식하지만 종자의 경우에는 꽃이 피기까지 4년이 걸린다.
31638,삼나무,"견고, 자신감",상록성 교목으로 원래 우리 땅에 나던 것은 아니다. 일본이 고향인데 우리나라에서는 남부지역에서 많이 재배된다. 어떠한 세찬 바람에도 넘어지지 않고 하늘을 찌를 듯이 우뚝 서 있는 그 모습이 견고해 보이고 자신감이 충만해 보인다.,"낙우송과 삼나무속이며 원산지는 중국, 일본으로 지구상에 딱 한 종이 분포하며, 몇 가지 품종이 개발되어 있다.","경남, 전남 이남 및 제주도 등에서 식재","개화기는 3월, 암수한그루, 수꽃은 타원형이다. 길이는 3.6~6.4(10)mm이고, 포에 4~5개의 꽃밥이 달린다. 암꽃은 구형이며, 뾰족한 자록색 포가 있다. 화분은 크기가 25~28μm 정도이고, 발아구가 뚜렷하게 원뿔형으로 1개가 발달한다. 화분체의 표면은 유두상 돌기물들이 분포한다.
"
29134,수선화,"자만심, 자존심, 자신만을 사랑하다",수선화의 유래를 보면 그리스신화에 나오는 미소년 나르시스(나르키소스)가 제 모습에 반하여 죽어 꽃이 되었다하니 그 정도의 자존심이면 꽃이 고개를 들만도 한데 꽃은 늘 땅을 바라보고 있다. 꽃 모양은 은 접시에 금잔이 놓여있는 듯 아름답고 향기도 강하다. 아름답고 똑똑한 것도 좋지만 너무 지나치면 결국 자기도취에 빠져 헤어날 수 없음을 가르쳐 주는 듯 하다.,"수선화과에 속하며 세계적으로 약 50종이 분포하는데 알뿌리류가 대부분이지만 숙근성인 것들도 있다. 적응범위가 넓어 해안가로부터 산 중턱에 이르기까지 널리 분포하지만 주로 초원지대에 자생한다. 유럽과 북아프리카가 주요 원산지이며, 우리나라에도 제주에서 자생한다. 수선화는 종에 따라 화형이 다른 것들이 많아 꽃의 모양을 기준으로 Trumpet, Large-cupped, Small-cupped, Double, Triandrus, Cyclamineus 등 총 12개의 형으로 구분한다. 수선화의 영명은 'Daffodil'이다.",제주도에 분포한다. 관상용으로 재배한다.,"꽃은 12-3월에 피며 판통은 길이 18-20mm, 꽃대는 높이 20-40cm이고 포는 막질이며 길이 5-6.5cm이고 꽃봉오리를 감싸며 화경 끝에 5-6개의 꽃이 옆을 향해 달린다. 꽃자루는 길이 4-8cm이고 화피열편은 6개로서 둥글지만 끝이 뾰족하며 길이 14-15mm이고 백색이며 하부는 긴 통상이다. 덧꽃부리는 높이 4mm로서 황색이다. 수술은 6개가 덧꽃부리 밑에 붙어 있고 수술대는 길이 1mm이며 꽃밥은 길이 3mm로서 T자형으로 붙어 있다. 암술대는 덧꽃부리와 길이가 비슷하다. 씨방은 하위이며 녹색이고 3실이다."
29135,아마릴리스,"수다쟁이, 눈부신 아름다움",본래의 아마릴리스는 Belladonna Lily를 말하며 오늘의 꽃은 여러 종을 교배하여 만들어낸 품종이다. 꽃이 크고 화려해서 아름다운 귀부인을 보는 듯한 느낌이 든다.,"수선화과에 속하며 세계적으로 약 70여종이 분포하는데 브라질, 페루 등 남미와 멕시코에 많이 자생한다.",온실에서 재배한다.,잎 사이에서 길이 30cm가량의 꽃대가 나온다. 꽃은 가꾸기에 따라서 다르지만 12월부터 피기 시작하며 짙은 적색 및 백색 바탕에 적색 무늬가 있거나 또는 적색 바탕에 백색 무늬가 있는 것이 많고 순백색의 것은 귀하다. 속이 빈 굵은 꽃대는 분백색이며 끝에 3-4개의 꽃이 밖을 향해 산형으로 달린다. 화피열편과 수술은 각 6개이고 암술은 1개이다.
26858,우묵사스레피,기억 속에 새기다.,남해의 세찬 바닷바람에도 잘 견디는 늘 푸른 나무이다. 뒤로 약간 말려들어간 동그랗고 작은 잎도 귀엽지만 열매가 쥐똥같이 생겼다 하여 섬 지방에서는 섬쥐똥나무라고도 부른다.,"차나무과에 속하는 상록성 관목이다. 세계적으로 아시아 동남부 및 태평양 열도를 중심으로 약 70종이 자생한다. 우리나라에서는 주로 제주지역이나 남부해안가에 자생하며, 유사종으로 사스레피나무, 거제도에 나는 섬사스레피나무, 잎이 넓고 두꺼운 떡사스레피나무 등이 있다.","중국과 대만,일본,인도 등지; 전라남도 및 경상남도 남쪽 해안과 섬.","꽃은 1 ~ 3개씩 달려 11월 중순에 피고, 지름 4 ~ 5mm로 연한 황록색이고 작은포는 둥글고 매우 작고 꽃받침조각은 2개이며 편원형이고 길이 1.5~2mm로서 털이 없으며 가장자리가 막질이고 꽃잎은 달걀형이며 길이 2mm이고 암술대는 길이 1mm이다."
25869,앵초,번영,"물결치는 듯이 곱슬거리는 잎이 인상적인 앵초는 전형적인 한국의 자생화다. 물론 우리와 자연환경이 비슷한 중국이나 일본지역에서도 자생한다. <br><br>
<br><br>
","앵초과의 다년생 초본이며 지구상에 500종이상 분포하는 전형적인 온대성식물이다. 우리나라에는 앵초, 키가 큰 큰앵초, 작은 설앵초, 좀앵초 등이 습기가 좀 있는 반그늘진 곳에 자생하고 있다.","한국, 일본, 중국 동부, 시베리아 등지에 분포한다.
전국 각처의 산지에 난다.",꽃은 4월에 피며 홍자색이고 꽃대는 높이 15-40cm로서 털이 있으며 끝에 7-20개의 꽃이 산형으로 달리고 총포조각은 피침형이며 꽃자루는 길이 2-3cm로서 돌기같은 털이 산생한다. 꽃받침은 통형이고 길이 8-12mm로서 5개로 갈라지며 열편은 피침형이고 끝이 뾰족하며 꽃받침 길이의 1/2-2/3이다. 꽃부리는 지름 2-3cm이고 판통은 길이 10-13mm로서 끝이 5개로 갈라져서 수평으로 퍼지며 끝이 파진다.
31797,치자나무,청결,"꽃의 모양과 색, 향기가 모두 일품이며, 특히 꽃향기가 진하다. 늦은 가을에 빨갛게 익는 열매는 대표적인 우리 전통 염료이다.",꼭두서니과 치자나무속 식물로 내한성이 약해 중부지역에서는 노지에서 자라지 못한다. 치자나무는 우리나라에서 자연 상태에서 자라기는 하지만 원래부터 우리나라에 있던 식물은 아니다. 무궁화와 마찬가지로 외국에서 들어와 이 땅에 적응한 귀화식물의 하나이며 원산지는 중국 · 대만 · 일본이다.,"일본, 오키나와, 대만, 중국; 남부지방에서 재배.",유백색의 꽃이 피며 독특한 향기를 풍기는 매력있는 화목이다. 원예종에는 겹꽃이 있어 더욱 화려하지만 결실하지 않는다. 꽃은 6 ~ 7월에 피며 꽃받침은 능각이 있고 끝이 6~7개로 갈라지며 열편은 가늘고 길다. 꽃부리는 백색이며 열편은 6 ~ 7개로서 긴 거꿀달걀모양이고 둔두이며 수술은 6 ~ 7개이고 후부(喉部)에 달린다.
34734,팔손이,"분별, 비밀",손이 여덟 개가 아니고 넓은 잎이 여덟 갈래로 갈라져 있는 것처럼 보여서 팔손이나무라 불린다. 언뜻 보면 외국의 관엽식물로 착각하기 쉬우나 우리 자생식물 중의 하나로 거제도나 남해 등 남부 해안가 주변이 고향이다. 잎 모양이 넓어 시원한 느낌을 주며 상록성이기 때문에 연중 관상이 가능하다. 음이온 발생도 많아 실내식물로 우수하다.,두릅나무과에 속하는 상록성관목이다. 세계적으로 아시아 동부지역에 단 2-3종이 분포하는 희귀종이지만 아열대의 온화한 기후조건에서 생육이 왕성하기 때문에 널리 자생한다. 우리나라의 남부지역이나 제주도에 자생한다.,일본; 경상남도 남해도(미륵)와 거제도(맥도)에 분포.,"우상모양꽃차례는 가지 끝에 모여서 원뿔모양꽃차례를 이루며 길이와 폭이 각 20 ~ 40cm × 5 ~ 8cm이고, 꽃은 지름이 5mm로 유백색이며 5수이고, 꽃받침열편이 뚜렷하고, 10월 ~ 11월에 개화한다."
29264,파초,기다림,뿌리줄기 끝에서 나오는 잎이 사방으로 점점 퍼지면서 길게 자란다. 잎은 밝은 녹색을 띠며 그물무늬가 평행을 이룬다. 언뜻 보면 바나나 잎을 닮아 여름동안 청량감을 더해주며 밝은 연초록의 잎은 이국적인 느낌을 주는 관엽식물이다.,"파초과에 속하는 여러해살이 풀이다. 지구상에 약 40종이 분포하는 상록성으로 인도 북동부, 방글라데시, 아시아 남동부, 일본, 호주 북부지역에 이르기까지 다양하게 분포한다.",온실에서 재배한다.,꽃은 길이 6-7cm이며 여름철에 잎 속에서 꽃대가 자라고 잎같은 포 안에 15개 정도의 꽃이 2줄로 달리며 꽃이 피면 포가 떨어진다. 대형의 꽃차례는 점점 자라면서 밑부분에서 암꽃과 수꽃이 같이 피고 윗부분에는 수꽃만 달린다. 씨방은 하위이며 녹색이고 화피는 황백색이며 상하 2쪽으로 되고 윗부분은 내꽃덮이 3개와 내꽃덮이 2개가 합쳐져서 5개의 돌기로 되며 밑부분의 것은 내꽃덮이 1개가 주머니처럼 되고 그 속에 꿀이 들어 있다. 수술은 5개이며 꽃밥이 길고 암꽃에서 간혹 열매가 달린다.
23136,호랑가시나무,보호," 크리스마스카드를 보면 빨간 열매를 달고 잎 끝이 가시 같은 잎으로 장식된 그림이 빠지지 않고 나온다. 바로 서양호랑가시나무인데, 오늘의 꽃은 우리나라에 자생하는 호랑가시나무이다. 잎 끝이 뾰족한 것이 호랑이의 발톱을 닮아서 붙여진 것으로 보이며, 꽃말도 가시가 침입자로부터 자신을 지킨다는 뜻에서 붙여진 듯 하다.","감탕나무과의 상록성 관목이다. 세계적으로 약 400종이 있으며 상록성은 물론 낙엽성인 것들도 많다. 우리나라에 나는 것으로 유사종은 주로 제주에 자생하는 먼나무, 꽝꽝나무, 좀꽝꽝나무 등이 있다.","중국 북부 ~ 남부 / 전라남북도, 제주도.","꽃은 암수딴그루 또는 잡성주로 4 ~ 5월에 피고 지름 7mm로 향기가 있으며, 우상모양꽃차례는 꽃이 5 ~ 6개씩 달리고 꽃대 길이 5 ~ 6mm로 털이 없다.  암술은 암술대가 없고 암술머리가 약간 높아져서 4갈래로 갈라진다."
28668,굴거리나무,자리를 내어줌,제주에 가면 아래로 젖혀진 넓고 긴 잎과 빙둘러난 잎자루가 유난히 붉은 빛을 띠어 꽃으로 착각하기도 하는 나무가 있는데 바로 굴거리나무이다. 길고 두꺼운 잎이 마치 고무나무와도 비슷하여 혹시 외래종인가 하는 착각도 든다.,대극과에 속하는 상록성 관목으로 아시아 동부지역을 중심으로 15종이 분포한다. 우리나라는 내장산과 남부해안 및 제주지역에 자생한다.,"중국; 전라남북도, 제주도, 충청남도 안면도, 전북의 내장산, 울릉도에 분포.","꽃은 암수한그루로, 3 ~ 4월에 개화하며 녹색이 돌고, 화피가 없으며 길이 2.5cm의 총상꽃차례로 잎겨드랑이에 달리고, 수꽃은 8 ~ 10개의 수술이 있으며, 암꽃은 약간 둥근 씨방에 2개의 암술대가 있고, 헛수술 발달했다."
23130,꽝꽝나무,굳은 의지,제주의 어느 식물원에 갔을 때 수형이 잘 다듬어진 울타리가 있어 회양목인줄 알았는데 자세히 보니 꽝꽝나무였다. 산굼부리 오르는 길 양쪽의 탄탄한 생울타리도 바로 이 꽝꽝나무로 만들어진 것이다. 나무줄기가 단단하여 붙여진 이름과 꽃말인 듯싶다.,"감탕나무과에 속하는 상록활엽관목이다. 세계적으로 약 400종이 있으며 상록성은 물론 낙엽성인 것들도 많다. 우리나라에 나는 것으로 유사종은 주로 제주에 자생하는 먼나무, 호랑가시나무, 좀꽝꽝나무 등이 있다.","중국, 대만, 일본; 제주도, 전라남북도, 경상남도.","꽃은 암수딴그루로, 7월 초에 개화하며, 수꽃은 짧은 총상 또는 복총상꽃차례로 3 ~ 7개씩 달리며 퇴화된 암술이 있으며, 암꽃은 잎겨드랑이에 1개씩 달리고, 꽃대가 길며 퇴화된 4개의 수술과 1개의 4실인 씨방이 있다."
30847,구상나무,기개,"구상나무는 세계적으로 우리나라에만 나는 한국특산식물이다. 잎도 잘 떨어지지 않고 수형이 좋아 외국에서는 크리스마스트리로 가장 귀하게 여기는 나무이기도 하다. 한라산 윗세오름이나 덕유산 정상에 가보면 고사목들이 서 있는데 기품이 당당하다. 주목은 살아서 천년 죽어서 천년이라 했는데, 구상나무는 살아서 백년 죽어서 백년이라 한다.","소나무과에 속하는 상록성 침엽수이다. 열매의 색깔에 따라 붉은구상나무, 검은구상나무, 푸른구상나무가 있으며 구상나무와 비슷한 것으로 분비나무와 젓나무가 있다. 한라산, 덕유산, 지리산 등지의 해발 1000m 이상에서 자생한다.","지리산, 덕유산, 가야산, 무등산, 한라산","개화기는 5~6월, 암수한그루, 수꽃은 타원형이며 길이는 약 10mm이다. 암꽃은 길이가 약 18mm이고 자주색 혹은 녹색이다. 화분은 크기가 90~100㎛ 정도이며 표면이 울퉁불퉁한 굴곡이 있으며 양쪽에 2개의 기낭이 있다."
40402,남천,지속적인 사랑,잎 모양이 대나무 잎을 닮아 중국에서는 남천죽이라고도 부른다. 늦은 가을부터 붉게 물든 잎과 붉은 열매가 좋다. 정원에 심겨 있으면 겨울에도 볼거리를 줄 수 있는 식물이다.,"매자나무과에 속하는 상록성 관목이다. 세계적으로 단 1속 1종이 있으며,  잎에 무늬가 있는 반엽종도 있다. 중국, 인도, 일본의 산이나 계곡에 자생한다.","중국, 일본; 남부지방에 식재.","양성꽃으로서 6~7월에 피고 가지 끝에서 나오는 길이 20~30cm의 원뿔모양꽃차례에 달린다.꽃잎은 6매이고 희다. 꽃받침조각은 3수이고 다륜성으로 배열하며 꽃부리는 백색이며 지름 6mm이고 꿀샘은 3~6개, 수술은 6개이며 꽃밥은 황색이고 세로로 터진다. 씨방은 1개이며 암술대는 짧고 암술머리는 손바닥모양이다."
23369,냉이,나의 모든 것을 바칩니다.,지금도 이른 봄이면 찬바람 나는 들판에서 나물 캐는 아낙네들을 볼 수 있다. 냉이는 꽃이 피기 전에 먹어야하니 2월이 제철이기 때문이다. 싱싱한 냉이 잎과 뿌리를 생각하면 벌써부터 그 향내가 코끝을 맴도는 것 같다. 꽃말처럼 냉이는 잎부터 뿌리까지 버릴 게 없다.,십자화과에 속하는 일년초이다. 전국에서 흔히 야생하며 밭에서는 쓸모없는 풀로 취급받기도 한다. 영명은 열매모양이 쌈지같이 생겼다 하여 붙여진 이름이다.,"▶세계적으로 분포한다.
▶전국 각지에 야생한다.",5~6월에 원줄기 끝에서 백색의 십자모양꽃부리가 많이 달려 총상꽃차례를 형성하며 화경이 있다. 꽃부리는 소형이며 꽃받침조각은 4개로서 긴 타원형이고 길이 1mm정도이다. 꽃잎도 4개이며 거꿀달걀모양으로서 길이 2-2.5mm이고 넷긴수술과 1개의 암술이 있다.
26901,동백나무,"겸손한 아름다움, 자랑",동백나무는 모든 부분이 버릴 것 없는 보배로운 식물이다. 일년 내내 표면이 반지르르한 잎이나 이른 봄에 빨갛게 피었다 일순간 떨어지는 꽃도 인상적이고 가을에 열리는 열매는 옛날 우리 어머님들이 머리손질과 화장품에 이용하기도 했던 동백기름의 원료이다.,"차나무에 속하는 상록성 소교목이다. 대표적인 난지형 식물로 지구상에 약 300여 종이 분포하고 있다. 우리나라에서는 내륙으로는 전북 고창 선운사, 해안으로는 황해도 장삿곶까지 자생한다.","중국, 대만, 일본; 황해도, 충청남도, 전라남북도, 경상남북도, 제주도.",양성꽃으로 적색이고 잎겨드랑이 또는 가지 끝에 1개씩 달려 1월 ~ 3월에 피고 반 정도 벌어지며 작은포는 둥글고 겉에 짧은 백색 털이 있다. 꽃받침조각은 5개이며 길이 1~2cm로서 달걀형의 원형이고 꽃잎은 5~7개가 밑에서 합쳐지며 길이 3~5cm로서 수술과도 합쳐지고 수술은 노란색으로 90~100개가 있다. 꽃밥이 황색이고 씨방에 털이 없으며 암술대가 3개로 갈라진다. 4월에 많이 개화한다.
39626,레몬,"성실한 사랑, 정절","감귤류 중에는 Citrus Limon이라고 하는 종류가 있는데, 이 식물의 열매가 레몬이다. 레몬은 과즙이나 과육에 향기가 있고 맛이 좋아 여러 용도로 쓰이고 있다. 요즘 신세대가 좋아하는 레몬소주, 향기가 좋은 레몬차, 상큼한 레몬음료, 껍질째 이용하는 마멀레이드 등... ",운향과에 속하는 상록소교목이다. 지구상에 16종이 있는데 원산지는 인도지만 캘리포니아나 지중해 지역이 많이 자생한다.,전세계,"꽃은 5∼10월에 피고 잎겨드랑이에 하나씩 또는 몇 개씩 무리지어 달린다. 꽃봉오리는 붉은 색이고, 꽃의 안쪽은 흰색, 바깥쪽은 붉은빛이 강한 자주색을 띤다."
31326,산자고,가녀린 미소,봄이면 원색적으로 화단을 장식하는 튜립 야생원종 중의 하나이다. 튜립 야생종으로는 우리나라에 산자고 한 종만 있어 귀하게 대접받아야 할 토종 자생식물이다. 숲이나 언덕의 시원하고 물이 잘 빠지는 곳에서 흔히 자생한다. 이른 봄에 큰괭이밥 등과 비슷한 시기에 꽃이 피며 꽃대가 가늘어 오후가 되면 꽃 무게를 잘 이기지 못하고 조금씩 구부러져 보는 사람을 애처롭게 한다.,"백합과에 속하는 여러해살이 풀이다. 우리나라는 물론이고 일본이나 중국에도 자생한다. 튜립은 워낙 유명한 알뿌리식물로써 무수히 많은 원예품종들이 개량되어 있으며 야생원종만 해도 100종이 아시아, 중동, 유럽의 온대성 지역에 다양하게 분포한다.","▶일본, 중국 등지에 분포한다.
▶제주, 전남(무등산, 백양산), 경기도(광릉) 등 중부이남에 야생한다.","꽃은 4-5월에 피고 길이 2-2.5cm로서 2-3개이며 꽃자루는 길이 2-4cm이다. 화피열편(花被裂片)은 6개이고 피침형이며 끝이 둔하고 길이 2-2.4cm로서 백색 바탕에 자주색 맥이 있다. 꽃은 백색으로 줄기끝에 한 송이 피는데, 위를 향해 벌어지고 넓은 종모양이다. 수술은 6개로서 화피 길이의 1/2정도이며 3개는 길고 3개는 짧다. 씨방은 녹색이며 세모가 지고 타원체로서 1개의 암술대가 있다."
42867,스위트피,"기쁨, 가련","꽃색이 흰색, 분홍, 빨강, 보라 등 다양하고 하늘하늘한 꽃잎은 나비를 닮았다. 17세기부터 관상용으로 재배가 시작되어 지금은 많은 품종이 개량되어 있다. 원래 장일성식물이었는데, 단일에도 꽃이 피는 종이 개발되어 지금은 겨울철에도 온실안에서 꽃을 피울 수 있게 되었다. 여름종과 겨울종의 교잡에서 춘계종이 만들어졌고, 하나의 꽃대에 7∼8송이의 꽃이 피는 다화성이거나, 덩굴이 뻗지 않는 왜성종 등이 개발되어 있다.",콩과에 속하는 한해살이풀로 덩굴성이다. 이탈리아의 시실리섬이 고향으로 햇볕이 잘 드는 양지에 군락을 이루고 있다.,재배종,"총상꽃차례는 잎겨드랑이에서 나오며 길이 20cm로서 끝에 2-4개의 꽃이 달리고 꽃은 5월에 피며 길이 2-3cm로서 접형이고 색은 붉은색, 흰색 등 여러가지이다. 꽃받침은 끝이 5개로 갈라지며 열편이 판통보다 길거나 비슷하다."
